{
  "version": "1.0",
  "status": "ready",
  "intent": "ranking",
  "subject": "customer",

  "metrics": [
    "average_total_asset"
  ],

  "dimensions": [],

  "filters": [],

  "entities": [],

  "time_range": {
    "type": "quarter",
    "year": 2026,
    "quarter": 1
  },

  "group_by": [],

  "having": [],

  "order_by": [
    {
      "field": "average_total_asset",
      "direction": "desc"
    }
  ],

  "limit": 20,

  "output": {
    "mode": "detail",
    "format": "table",
    "include_details": true,
    "include_explanation": true
  },

  "ambiguities": [],

  "assumptions": [],

  "confidence": {
    "overall": 1.0,
    "intent": 1.0,
    "metrics": 1.0,
    "dimensions": 1.0,
    "entities": 1.0,
    "time": 1.0,
    "filters": 1.0
  },

  "context": {
    "parent_plan_id": null,
    "operation": "new"
  }
}