{
  "version": "1.0",
  "status": "ready",
  "intent": "customer_selection",
  "subject": "customer",
  "metrics": [],
  "dimensions": [],
  "filters": [
    {
      "id": "f1",
      "type": "entity",
      "target": "held_product",
      "operator": "exists",
      "value": "P_GZM",
      "source": "entity_resolution",
      "confidence": 0.98
    }
  ],
  "entities": [
    {
      "entity_type": "product",
      "surface": "贵州茅台",
      "resolution_status": "resolved",
      "resolved": {
        "id": "P_GZM",
        "name": "贵州茅台",
        "entity_type": "product",
        "attributes": {}
      },
      "confidence": 0.98,
      "source": "exact_match"
    }
  ],
  "time_range": null,
  "group_by": [],
  "having": [],
  "order_by": [],
  "limit": null,
  "output": {
    "mode": "detail",
    "format": "table",
    "include_details": true,
    "include_explanation": true
  },
  "ambiguities": [],
  "assumptions": [],
  "confidence": {
    "overall": 0.98,
    "intent": 1.0,
    "metrics": 1.0,
    "dimensions": 1.0,
    "entities": 0.98,
    "time": 1.0,
    "filters": 0.98
  },
  "context": {
    "parent_plan_id": null,
    "operation": "new"
  }
}
