{
  "version": "1.0",
  "status": "ready",
  "intent": "metric_query",
  "subject": "customer",

  "metrics": [
    "total_asset",
    "net_inflow"
  ],

  "dimensions": [],

  "filters": [],

  "entities": [
    {
      "entity_type": "customer",
      "surface": "C00000000000169",
      "resolution_status": "resolved",
      "resolved": {
        "id": "C00000000000169",
        "name": "C00000000000169",
        "entity_type": "customer",
        "attributes": {}
      },
      "confidence": 1.0,
      "source": "exact_match"
    }
  ],

  "time_range": {
    "type": "quarter",
    "year": 2026,
    "quarter": 1
  },

  "group_by": [],

  "having": [],

  "order_by": [],

  "limit": null,

  "output": {
    "mode": "summary",
    "format": "table",
    "include_details": false,
    "include_explanation": true
  },

  "ambiguities": [],

  "assumptions": [],

  "confidence": {
    "overall": 1.0,
    "intent": 1.0,
    "metrics": 1.0,
    "dimensions": 1.0,
    "entities": 1.0,
    "time": 1.0,
    "filters": 1.0
  },

  "context": {
    "parent_plan_id": null,
    "operation": "new"
  }
}